title,account,date,content,url,project_date,project_location,contact_info
志愿服务｜“提供远程支教，助力乡村振兴”北师大地理学部团委携手腾讯企鹅支教共同招募志愿者！,北师大地理科学学部学生之家,2024-4-27,党的二十大报告对办好人民满意的教育作出重要部署，强调要“推进教育数字化”。为贯彻落实习近平总书记关于抓好“立德树人”根本任务、科教兴国、人才强国战略的要求和党中央关于巩固脱贫攻坚成果、全面推动乡村振兴的重要部署。北京师范大学地理科学学部团委携手腾讯企鹅支教开展“提供远程支教，助力乡村振兴”项目，在北京师范大学共招募300名远程支教志愿者，为甘肃、青海、重庆、陕西等中西部地区乡村小学提供远程支教服务，为乡村孩子们提供优质教育资源。Part.01 腾讯企鹅支教简介企鹅支教通过联合公益志愿者和行业生态伙伴共创优质教学资源，借助信息化、数字化能力，给孩子们带去优质教学和双师教学体验，为教育公平普惠贡献一份力。志愿者利用企鹅支教平台和远程技术支持，通过“志愿者线上授课+本校教师协助”的双师课堂模式开展，志愿者每次上课面对一个班级，为孩子们开展素养类课程。根据支教学校的课程需求与上课时间、志愿者的意愿和可授课时间进行匹配，为志愿者进行分组排课，上课形式为支教小组内2~3名志愿者按周轮流授课。Part.02 腾讯支教课程介绍本项目支教对象为甘肃、青海、重庆、陕西等中西部地区乡村小学学生，课程均为素质发展类课程，支教平台为志愿者提供课程配套的PPT、教案等材料。志愿者报名时需填写每周能够线上支教的时间，经过审核、学习培训、笔试、试讲、培训后方可开展支教工作。课程内容包括但不限以下内容：职业启蒙课:针对3—5年级学生开展职业启蒙课程，为乡村小学生介绍常见职业，发掘兴趣，启发同学们对人生规划的思考。健康与幸福课：以“幸福”与“健康”为主题，以培养学生的社会情感技能发展为宗旨，包含心理和情绪、成长营养与安全等内容。美术鉴赏课：中外世界名画及艺术作品赏析课，为学生介绍不同的艺术风格、美术历史，重视学生绘画实践体验环节。地理科普等课程在陆续开发中……Part.03 服务要求01 服务周期2024年春季学期、秋季学期，即2024年4月—2024年12月，寒暑假期间不支教。02 基本要求北京师范大学全日制在读学生，年满18周岁大学生，对支教活动有热情，有责任心。03 时间保障每周周一到周五至少有一天有固定空余的45分钟授课时间，至少连续支教一学期。04 良好素质1）具有高尚的爱国主义情操，社会责任感强，遵纪守法，积极向上；2）热爱教育事业，具备良好的志愿服务精神、团队合作精神；3）工作认真负责，有耐心，有灵活应变能力；4）具备良好的表达能力和逻辑思维能力，普通话标准，吐字清晰。05 设备要求自备电脑且电脑有摄像头，熟悉电脑操作，具备稳定的网络环境，能够保证正常授课。06 态度要求按时备课、完成教学、参加教学培训，积极配合项目团队在支教过程中开展的各类工作。07 在符合以上条件的基础上，具备以下任一条件优先考虑1）中共党员或中共预备党员；2）积极参加志愿活动，具备支教或其他形式的教学经验；3）已获得中小学教师资格证书。Part.04 志愿者收获1教学资源丰富的课件资源、授课经验分享、技能培训。2志愿者服务证书志愿者可获得支教志愿者服务电子证书3相关纪念品授课志愿者可获得支教相关纪念品。Part.05 报名方式1人数：预计招募志愿者300人。2报名：请符合申报条件的学生于2024年4月18日24点前扫描二维码填写报名表：3初审：团队对收到的报名表进行逐一审核，并将初审通过的志愿者名单录入后台系统。4认证：通过初审的志愿者收到录用通知后，登录“企鹅支教”小程序，进入“认证教学用户”任务环节，完成培训课程的学习（约1个小时）。5笔试：完成培训课程学习后进入线上笔试。6试讲：通过笔试的志愿者按要求提交试讲视频并提交审核，运营团队根据试讲情况，确定最终志愿者名单。7岗前培训：录取为正式志愿者后，将会收到短信通知添加对应分配地区的企鹅支教小助手，参加企鹅支教平台组织的岗前培训。8分组排课：培训后，由企鹅支教小助手和志愿者沟通分组事项，预计2-3人为一个支教小组，组内成员按周轮流授课。9日常答疑：日常支教过程中的问题，将由地区对应的企鹅支教小助手全程服务解答，同时提醒志愿者日常备课上课等。 山海与共让我们共沐同一片暖阳跨越千里让我们共赴一场支教之约加入我们成为远程支教志愿者以热忱为桨，以真诚为帆共同点亮孩子们的童年梦想\ | /★文字丨地理科学学部排版丨宣传部 江亚芪审阅丨石月婵 刘 倩地理科学学部,https://mp.weixin.qq.com/s?src=11&timestamp=1751859584&ver=6097&signature=DLUmV-5PbN-D4QvKY2oqeoFAAuaUfw3t3h4HR9arGv1*bgX-HYvOU-6qyuoJrvy0vUYXXXIAxzowoAoxxQOyCMTFCXoukVgQ72YgbRlFqq1GMbRT4KfLeS3PYj*SCYHE&new=1,2024年4月18日,抓好“立德树人”根本任务,二维码
支教招募| 北师大滇行支教队第六届招募令来喽！,北师大滇行支教队,2023-4-3,这个夏天一起去云南支教！2023 来自滇行支教队的邀请~ 此次暑假，我们将延续前五年滇行支教队的传统，继续前往云南省临沧市永德县第一完全中学进行支教。 临沧市位于美丽富饶的云南西部，南靠西双版纳，北临大理，民风朴素。永德县山川秀美，资源丰富，四季如春，被誉为“云南芒果之乡”，是云南省风景旅游胜地。永德县第一完全中学创办于1937年8月，是临沧市办学历史较为悠久的学校之一。其办学规模随着社会的发展不断扩大，近几年来规模扩大尤为迅速，是临沧市办学规模较大的学校之一。自办学以来，该校教学质量逐渐完善，学子遍布五湖四海，为各级各类院校输送大批优秀人才，是临沧市办学质量较好的学校之一。 我们此行支教的对象是永德县一中的准高三学子。教学过程中，你需要配合任课老师的教学过程，开发属于你自己特色的习题课，传授学习经验，分享你的学习心得。你更有机会向同学们描述你的大学生活体验，讲述属于你自己的师大故事。往期支教队合影与永德县的美景specific information具体信息支教时间8月2日-8月17日（可能出现小范围浮动）支教地点云南省临沧市永德县第一完全中学支教对象即将进入高三的学生活动内容课程讲解：根据学校安排，配合相关任课教师，进行部分基础学科和拓展学科的讲授。学习经验交流：传授自己的学习经验，讲述一些有趣的学习故事，阐述自己在北师大的生活。心理疏导：为这些即将踏上高考的同学进行心理辅导，调节他们紧张的心态。向右滑动查看更多往年支教精彩瞬间 生活保障支教校区为新校区，环境良好；支教学校提供食宿，质量保障；住宿地点附近有超市，生活便利。支教队员需要自行前往昆明集合，从昆明抵达支教地点交通由支教学校负责。（ps：可能会选择乘坐约10h的长途大巴车，晕车的同学务必慎重考虑，并征得家长同意！）requirements招募要求1. 北师大在校本科生（不包含大四毕业生），共计7-9人。2. 有摄影修图、制作视频等技术特长，文笔优美，有调研和支教经验的同学优先考虑。3. 热爱教育事业，愿意与高三学生交流，有团队协作精神。报名方式点击文末附件下载2023滇行支教队简历及教案模板填写完成后发送至202111051016@mail.bnu.edu.cn（命名为：年级＋院系+名字+支教报名）注：如果试讲环节需要PPT，请将PPT与教案一同发到所给邮箱报名截止时间4月11日(周二)晚24:00报名截止后，我们会通过短信方式通知面试时间和地点面试内容8分钟试讲（包括简单的自我介绍）2分钟提问联系方式如有任何问题需要咨询，请加入QQ群687744807（2023滇行支教交流）扫描二维码关注北师大滇行支教队附件1：2023滇行支教报名表.docx附件2：2023滇行支教队教案模板.docx,https://mp.weixin.qq.com/s?src=11&timestamp=1751859584&ver=6097&signature=0q6gKB9SjlY0QYAffqTKsX62LOTxu0dUKbevuttfenazL-zqUMLIk835XxjCnEhzD-F-NCHAshYx05ISxwGlJAaXaKtdRhx50XdPKI0jlWkvrFu8YKXFN7cUB*SmqM5G&new=1,8月2日-8月17日,云南省临沧市永德县第一完全中学支教对象即将进入高三的学生活动内容课程讲解：根据学,20211105;202111051016@mail.bnu.edu.cn;68774480;二维码
【志服】志愿招募丨北师红十字会招募校园志愿者啦！,BNU红会,2023-4-18,志招愿募- 【志服】 -校园志愿者招募令想要获得充足的志愿时长？想要丰富空闲的课余时间？想要在帮助他人的过程中提高自我与实现自身的价值？那你就来对地方啦！我们是北京师范大学红十字会（学生分会）志愿服务中心，我们在传播“人道 博爱 奉献”的红十字精神的同时，致力于为更多同学提供志愿服务的平台与机会。往下阅读，快来pick你心动的志愿服务活动吧！温馨提示：1.正在开展的活动时间、地点与报名方式，均在文末有汇总。2.以下所有活动报名仅单次有效，志愿者不需要长期从事该志愿工作，可根据个人空闲时间灵活选择。 - 01 - 面向全校的个人志愿服务活动夕阳再晨科技助老志愿者前往社区陪伴爷爷奶奶，回答他们对使用智能设备的疑问，帮助他们更好地融入信息化社会，教老年人使用智能设备的同时，志愿者的陪伴和关怀也为社区老人们的生活送去了温暖。左右滑动查看更多鹤童社区助老进入社区养老驿站从事帮助老人的志愿活动。常规服务：协助整理老人档案和星级评定资料，拨打电话向老人介绍上门服务内容及约定服务时间。补充服务：可申请参与入户调研，为社区的老人提供面对面的服务。左右滑动查看更多海军总医院导诊为患者提供就医帮助，服务内容主要包括以下部分，届时将有医院工作人员提供培训。1、就医帮助：帮助患者了解就医流程，为老弱及行动不便的患者提供自助机、挂号、检查单打印、报告单打印及住院等事项帮助；2、维持就医秩序；3、病房服务：协助科室为初入院和出院患者提供指引；4、特殊人群服务：为视力残疾人、听力残疾人提供包括挂号，科室就诊，缴费，化验，检查取药在内的全程信息无障碍协助。左右滑动查看更多 桶前值守在社区垃圾桶前值守，监督提醒扔垃圾的居民进行垃圾分类投放。左右滑动查看更多 校医院志愿者负责北师大校医院门诊引导和财务报销的协助工作，为前来就医的患者提供挂号引导、协助办理财务报销等。左右滑动查看更多暑期支教北师红十字会志愿服务中心运行支教项目已有6年历史，过往的支教队曾前往贵州、四川、山西、江西、内蒙古等多地，在教授基础知识的同时，结合红会特色创新支教形式，传播红十字精神和师大精神，为教育落后地区的孩子们带去知识和关爱。左右滑动查看更多 - 02 - 面向全校的集体志愿服务活动益行千“理”北师红十字会志愿服务中心将不定期组织公益性徒步垃圾清理活动，可为集体（班集体、团组织、党组织等）提供志愿服务活动名额，该类活动目前不接受个人报名。若要以集体为单位参加此类活动，可进群联系群主/管理员。左右滑动查看更多往期活动详情：【志服】活动总结丨雷锋月香山徒步垃圾清理 - 03 - 志愿服务中心活动概览活动名称活动时间活动地点工作时长夕阳再晨科技助老根据社区安排而定北师大周边社区1.5h/次鹤童社区助老每周一至周六9:00-12:0014:00-17:00西城全总社区养老服务驿站至少1.5h/次海军总医院导诊每周一至周五9:00-12:0013:30-16:30周六周日9:00-12:00中国人民解放军总医院第六医学中心3h/半天6h/全天桶前值守每天19:00-20:00北三环中路40号社区1h/次校医院志愿者门诊：周一至周五8:00-9:409:40-11:2014:00-15:4015:40-17:20北京师范大学校医院 2h/次报销：每周三8:00-9:409:40-11:2014:00-15:4015:40-17:20北京师范大学校医院 2h/次暑期支教招募招募时间：4月—5月活动时间：7月—8月多地暑期某时间段报名方式：非红会成员可扫码加入下方QQ群，红会成员可关注红会大群消息，工作人员会定时发布所有活动的招募信息。志愿服务交流群1（若此群已满，请加2群）志愿服务交流群2文案丨忆星 排版丨柚子 审核丨金鱼 责编丨金鱼,https://mp.weixin.qq.com/s?src=11&timestamp=1751859584&ver=6097&signature=2HWbuXG0T2tWPA3-IX9cdpOXf1e2l2B5nKWj6Bb4rtuy0*NRaWHAOoK6A8ZnIJs4D89mi*8MzhYilRZbDmsYvm*PQb5MiIK5VDRhWfxNj9i2XWAv-dWubtk9ImThS3AI&new=1,,与报名方式，均在文末有汇总。2.以下所有活动报名仅单次有效，志愿者不需要长期从事,
【重磅】北师大滇行支教队第五届队员招募啦！,北师大滇行支教队,2022-4-17,宝，听说又有一个支教队开始招募队员了什么？！快让我康康！朋友，有兴趣暑期支教吗？——北师滇行支教队向您发出邀请基本●资料BASIC IMFORMATION此次暑假，我们将延续前四年滇行支教队的传统，继续前往云南省临沧市永德县进行支教。 临沧市位于美丽富饶的云南西部，南靠西双版纳，北临大理，民风朴素。永德县山川秀美，资源丰富，四季如春，被誉为“云南芒果之乡”，是云南省风景旅游胜地。 我们此次支教的对象是永德县一中的准高三学子。教学过程中你需要配合任课老师的教学过程，开发属于你自己特色的习题课，传授学习经验，分享你的学习心得，描述大山外面的世界，讲述属于你自己的师大故事。 永德县第一完全中学创办于1937年8月，位于云南省临沧市永德县，初名为镇康县立中学，1964年永德、镇康分县，改名为云南省永德中学，现名为永德县第一完全中学，是临沧市办学历史较为悠久的学校之一。其办学规模随着社会的发展不断扩大，近几年来规模扩大尤为迅速，是临沧市办学规模较大的学校之一。永德县第一完全一中自办学以来，教学质量逐渐完善，学子遍布五洲四海，为各级各类院校输送大批优秀人才，是临沧市办学质量较好的学校之一。2022年8月相约彩云之南South of clouds彩云之南！我已经开始感兴趣了！\(^o^)/~好耶！那再来康康具体的支教信息和队员要求吧~息信●体具SPECIFIC IMFORMATION支教时间8月3日-8月18日（可能出现小范围浮动）支教地点云南省临沧市永德县第一完全中学支教对象即将进入高三的学生活动内容1. 课程讲解：根据学校安排，配合相关任课教师，进行部分基础学科和拓展学科的讲授。2. 学习经验交流：传授自己的学习经验，讲述一些有趣的学习故事，阐述自己在北师大的生活。3. 心理疏导：为这些即将踏上高考的同学进行心理辅导，调节他们紧张的心态。招募要求1. 北师大在校本科生（不包含大四毕业生），共计9-11人左右。2. 有摄影修图、制作视频等技术特长，文笔优美，有调研和支教经验的同学优先考虑。3. 热爱教育事业，愿意与高三学生交流，有团队协作精神。生活条件支教校区为新校区；学校提供食宿；附近有超市，生活便利。注意事项如无意外状况，支教队将于8月3日在昆明集合。此时很多同学已经回家，如没有顺路同伴，可能要独自坐火车到昆明；另外，从昆明到支教地可能会选择乘坐大巴车，大致需要15小时车程。很欢迎大家到云南支教，不过家离云南远、会晕车的同学务必慎重考虑，报名前先征得家长同意。2022年8月走上三尺讲台Three foot podium我明白了！那我该如何报名呢？别急，就在下面~报名●事宜REGISTRATION MATTERS报名方式点击文末阅读原文下载2022滇行支教队简历及教案模板~填写完成后发送至202011051044@mail.bnu.edu.cn（统一命名为：年级＋院系+名字）报名截止时间4月24日(周日)晚24:00报名截止后，我们会通过短信方式通知面试时间和地点面试内容8分钟试讲（包括简单的自我介绍）2分钟提问联系方式如有任何问题需要咨询，请加入QQ群：1032319276（滇行支教队交流群）也可以在公众号后台留言小编会及时回复的~2022年8月追寻最初的梦想Following dreams明白辽~我会慎重考虑之后再报名的！嗯嗯！那就好！现在，再让我们看一看往届支教队员们的风采吧~扫描二维码关注北师大滇行支教队~,https://mp.weixin.qq.com/s?src=11&timestamp=1751859584&ver=6097&signature=0q6gKB9SjlY0QYAffqTKsX62LOTxu0dUKbevuttfenaQeFm46D-O5H3CWUaMwlUMqffa*EX45SfbFb-KrxxJ4mLbIJ-6RhtsPwSshj9e6IL4wuErCHXZvAN49lKWo1ny&new=1,8月3日-8月18日,云南省临沧市永德县第一完全中学支教对象即将进入高三的学生活动内容1. 课程讲解：,10323192;20201105;202011051044@mail.bnu.edu.cn;二维码
北师红会支教招募 | 心向江曦，热忱如炬,BNU红会,2022-5-23,江曦招募令心向江曦，热忱如炬！◆ ◆ ◆ ◆生活不止有眼前的苟且，还有诗和远方。面对北京疫情越发严重的现在，我们只能积极配合；但好在我们还拥有即将到来的暑假。无论是躺家躺平享受美食追剧，还是出去游山玩水，相信大家已经在规划暑假出行打算弥补现在想在北京“逛吃逛吃”的心。但你是否想来一场与众不同但又充满意义的旅行呢？思来想去是否还是没有头绪呢？那就来一场与众不同的研学旅行吧！快来看看bnu红会的支教活动吧！相关信息 ◆ ◆ ◆ ◆2022年北京师范大学红会支教团——“心向江曦”支教队开始招募啦！盼望用关爱与引导带给小朋友们知识与能力，培养他们对于学习的兴趣，在面对小朋友们因为收获知识而发出笑意时收获成长，教学相长。在为小朋友们讲授科学文化知识之余，我们还增加了红会的特色科目，设置了急救、防灾、防艾等方面的课程，让小朋友们拥有更多保护自己的知识。敲重点：志愿支教可以计入志愿时长哦~01 具体信息支教地点：江西省上饶市鄱阳县油墩街西湖小学支教方式：线下授课（因疫情影响会调整）支教时间：7月10日-7月25日02 课程内容以语数英等基础学科为主，急救技能、防灾、防艾知识等为辅，同时招募其他学科成员（地物化体），也可兼顾多种兴趣课堂。03 招募人数8-9人<< 滑动了解西湖小学 >>招募要求1. 个人热情、真诚、有担当、有责任意识、有耐心、有丰富的知识储备及良好的ppt制作技能；2. 有急救、防艾、防灾知识内容储备者优先（红会中的拥有这些知识的小红豆可以速速报名啦！）3. 有推送排版技能和剪辑设计技能、摄影经验与专业装备者优先考虑！4.已经接种过三针新冠疫苗的北京师范大学海淀校区在籍学生。报名方式 报名方式：进群填写报名表【ddl：5月28日（周六）中午12点】此次招募面向全校同学！！！不论专业年级，有意向参与的同学可以加入QQ群：902925019（也可以直接扫描二维码哦），后续通知我们会发在群里哦！快来参加这次支教活动吧！还可以参加红会的其他活动哦！除了可以结交不同院系的朋友、收获满满的幸福感，还能领取丰富的志愿时长喔！微信公众号 | BNU红会 微博 | 北京师范大学红十字会文案|星昼排版|星昼审核|二狗责编|加贝,https://mp.weixin.qq.com/s?src=11&timestamp=1751859584&ver=6097&signature=2HWbuXG0T2tWPA3-IX9cdpOXf1e2l2B5nKWj6Bb4rttlFguhuBzpkalOVX6GwEvUoYs7YDnUxgyjWVCXButAnXpXAcUX1va1FIREDrDTLqfhFnBqxD87ID5Z5Y3II68s&new=1,7月10日-7月25日,江西省上饶市鄱阳县油墩街西湖小学支教方式：线下授课（因疫情影响会调整）支教时间：,90292501;二维码
支教招募 | 北师大云梦支教队云南鹤庆,北师大白鸽青协,2016-4-26,心有云鹤梦 师向西南端1 团队介绍云梦支教队是北京师范大学白鸽青年志愿者协会下的的暑期社会实践团队之一，我们将带着白鸽精品课程体系——梦想课程前往云南大理州鹤庆县，与那里的学生一起碰撞梦想的可能。梦想课程体系已经有了5年的实践基础，我们将在此基础上和你一起探索创新完善，等你加入！2 开展形式本次支教以夏令营形式进行，具体的课程模式采取“3+x”的形式，即高中趣味知识、生涯梦想课程、素质拓展课程三大模块的基本课程和根据队员特长开设与生涯梦想课程衔接的特色选修课。我们期望突破短期支教的局限，实行朋辈导师制，以建立长期陪伴关系为目的，每位队员全程对8名左右学生负责。3 时间地点支教时间：7月18日至7月31日培训时间：5月、6月不定期（两周一次）培训，7月13日－7月16日集中培训支教地点：云南大理州鹤庆县，位于云南省西北部，大理白族自治州北端，靠近丽江（仅有20分钟车程哦）。它历史悠久，茶马古道横贯南北。风景优美，夏天气候温和、温度宜人。是不是敲美？ 还有更美的哟！ 4 你在这里能得到技能！真实有效的教学技能经验！课程设计经验、教学评量经验感情！和志同道合的小伙伴们朝夕相处，友谊的小船飘啊飘（升华成爱情的巨轮也说不定）健康！山美水美空气好的地方很养生有木有 我知道你们想要的是美食啊丽江啊大理啊雪山啊云海啊，支教结束后顺路去一下！（严肃脸）5 我们需要的你1、 能够保证全程参与培训（最重要，报名前一定要考虑好自己的时间安排哦）2、 未来职业可能是教师，或者对有效教学有兴趣3、 能够保证认真参与课程的编制（任务真的很重）4、 有批判性思维且有一技之长，可以独立教授一门完整的选修课程（参考以下选修课方向：体育、美术、音乐、电影、手工、性别、人权、多元文化、全球化、环境、心理咨商、互联网、理财、法律……不局限于上述方向）注意！注意！ 报名表下载请点击阅读原文链接，意向地点填“云南大理鹤庆”噢~ 报名截止日期：2016年4月29日24点,https://mp.weixin.qq.com/s?src=3&timestamp=1751859584&ver=1&signature=A1f0qYVP1Gbl3MF-bua3PsUs*qdvUWpi2RboQqsKtW*wSK9kDOx9i49VOB2rI497RoClbdGkV0qDexZqp*-KAvJsdQx*hkTaTKnFqN*FxFaUBl3v*JhwWd7oYC*-gwZhXygX1n6EW-tS0qTuid9mRjNlGdf3dU860xYjp423YOE=,7月18日至7月31日,支教时间：7月18日至7月31日培训时间：5月、6月不定期（两周一次）培训，7月,
