title,account,date,content,url,project_date,project_location,contact_info
哲思支教丨面对疫情，北师大学子在行动,哲思青年,2020-3-14,哲思线上抗疫支教队自2020年3月7日成立，由哲学学院哲思辩论队发起，依托北师大各专业在读青年志愿者，建队初衷是为战斗在全国各地抗疫一线的医护人员子女提供课业辅导和心理疏导。目前线上支教队已促成24名志愿者与各地防疫一线家庭的对接，其中涉及武汉科技大学附属天佑医院、天津中医第一批援鄂医疗队、海南第一批援鄂医疗队、深圳第三人民医院（深圳唯一收治新冠确诊患者的医院，并获盖茨基金会资助，联合开展新冠病毒的研究）、深圳肿瘤医院、长沙市第三医院（长沙市疑似病例唯一收治点）、天津市宝坻区人民医院（该区确诊病例约占全市二分之一）、唐山市传染病医院、中国人民解放军联勤保障部队第983医院、北京同仁医院、首都医科大学附属北京中医医院等一线医护人员。图为被服务一线医护工作者随着疫情发展，我们注意到，警察作为“战疫”中的一支特殊队伍，在保护医务工作者和患者安全、指挥交通、处理各类涉疫警情中起到了举足轻重的作用。为了应对突发事件，他们夜以继日，截止目前，全国已有59名民警因公牺牲。因此，我们把一线警察也纳入了支教服务范围，目前已促成3名志愿者的对接。此外，我们与共青团昌平区委展开合作，希望对辖区内重建小汤山医院的一线工作人员家庭子女提供课业辅导。图为志愿者支教过程队长有话说哲学学院2018级思想政治教育专业 郭伯轩成立这个支教队的初衷，就是觉得灾难面前，国家培养的高校青年，总该做点什么，而一直坚信“知识就是力量”，也让我觉得我们确实可以做点什么，于是就做了这个尝试，以哲院为基础做了一次宣传，但很快随着口口相传，当天晚上，我们就拥有了一支涵盖各基础学科的支教团队。实话讲，那一晚不断地有人咨询我支教事宜，不断地有人加群，这速度是我做尝试的时候没敢想的。一周近三十单的成绩，数字背后是我们北师大学子用实际行动让一线医护人员不至于在前线轮班的同时，还要挂念着家里的孩子。如果非要说的话，这场抗疫战争中，我们的队伍就是后勤班，这让我为队伍里每一名队员感到骄傲。借用我一名队员的话，加入这个支教队是我2020年做的第一件绝不会后悔的事情。抗疫路程依然漫漫，北师大学子将继续为祖国守住二线，武汉加油!祖国加油！世界加油！哲思支教队现面向北师大在读生继续招募志愿者，有志为抗疫一线工作人员子女辅导课业的同学，请加下面的二维码，身份验证后方可入群。供稿丨哲思抗疫支教队供图丨哲思抗疫支教队编辑丨新闻中心 马一萌责编丨新闻中心 杜 娟,https://mp.weixin.qq.com/s?src=11&timestamp=1751859595&ver=6097&signature=5nvbCssTPFt0qTbqtwiZseh3ovU6z*iuauDbWZ0ZAESz8Eneh3ApLwIViCTFwMYcu1UpL13RnTOWpoOY2mnGe2PJAoI0ZVOgA7y9nROy*xmNqonenXEqKNvrmY1SXF-o&new=1,2020年3月7日,读青年志愿者,二维码
支教招募 | 外文学院OASIS绿洲研究生支教队招募令,北师外文,2021-5-12,"点击上方“北师外文”可以订阅哦In the distant place,I hope I am your Oasis.北京师范大学外文学院Oasis（绿洲）研究生支教队开始招募啦！加入绿洲，度过一个充实丰富的暑假！01 认识绿洲OasisOasis（绿洲），是浩瀚沙漠中的片片沃土，是沙漠瀚海上美丽的珍珠，代表着生命与希望。外文学院Oasis（绿洲）研究生支教队成立于2017年，是北京师范大学外文学院研究生会下唯一的暑期社会实践团队。今年暑假，我们将带着特色英语课程第四次前往福建省宁德市霞浦县第一中学，为那里的孩子们开拓外语学习中的一片绿洲。02 了解绿洲Oasis支教时间：2021年8月初，时长两周支教地点：福建省宁德市霞浦县第一中学 与北师大一样，霞浦一中也创办于1902年，这是一所拥有百十年历史的中学，也是闽东办学历史最为悠久的百年老校。学校坐落于美丽的福建省宁德市，校园环境优美，拥有教学楼、图书馆、科技楼、体育馆等现代办学设施。是“福建省一级达标高中”、福建省首批示范性普通高中建设学校、福建省文明校园。12支教对象：霞浦一中新高一学生支教内容： 支教以外语夏令营的形式开展，采取“语言必修课”+“兴趣选修课”的形式，根据队员的专业和特长，开设非传统英语课程（例如英语写作、辩论、演讲、戏剧等），并举办比赛与汇报演出，旨在培养高中生对语言学习的兴趣，引导正确的语言学习方法，拓宽语言学习视野，培养中西文化意识，锻炼逻辑思维能力，促进学生综合素养的培养。1234▵ 往年支教经历扫描二维码关注绿洲，可查看往届支教精彩瞬间。03 加入绿洲Oasis招募人数：20人左右支教福利：（1）宝贵的实战教学与教研经历；（2）与学生、队友之间的真挚情谊；（3）美丽舒适的环境，可口的饭菜。左右滑动查看更多招募要求：（1） 北京师范大学外文学院非毕业年级研究生，且2021年暑期并未参加其他支教队；（2） 认真积极，性格开朗，责任心强，热爱教育事业；（3） 能自主设计课程，有相关教学经验者优先；（4） 有文体特长或擅长摄影、推送制作、视频剪辑者优先。选拔流程：问卷星报名——初筛——面试试讲——确定成员名单报名方式：扫描下图二维码，填写问卷星（请勿重复填写）扫描二维码加入QQ群，了解更多信息。初筛结果将在QQ群内公布。报名截止时间：5月19日（周三）20:00Make Language ENGterestingMake Education ENGspiring这个夏天，绿洲与你，相聚霞浦，不见不散！外文学院Oasis研究生支教队编辑 | 薛雅婷审核 | 张新颖、严灵卉 北京师范大学外文学院学生工作办公室微信：搜索“北师外文”关注官方微信平台或扫描下方二维码微信号：bnusfll",https://mp.weixin.qq.com/s?src=11&timestamp=1751859595&ver=6097&signature=XnLWV*8bUmLSOlddVcnRvh3eOebRlFtzMPE3DaQbllntLGGWM14qQUnjAxXhFDZJG7nbYGF*xUTTJXqz7GNG3UI7QHreuNBPmXDYmMinhOVFBFO0ppNaMSEaN4dpWHB8&new=1,,福建省宁德市霞浦县第一中学 与北师大一样，霞浦一中也创办于1902年，这是一所拥,二维码
北师红会支教招募丨不负蜀光不负你,BNU红会,2022-5-14,又是一年夏，暑假即将到来，在假期的日子里，你准备做什么呢？你是否曾在暑假过惯了百无聊赖的日子，内心却期望着“给我点事做”？你是否梦想用自己的正能量影响他人，却苦于无法实现？那么，可以考虑一下北师大红会支教团“不负蜀光”！我们的知名校友鲁迅先生曾说过：“愿中国青年有一分热，发一分光，就令萤火一般，也可以在黑暗里发一点光，不必等待炬火。”这个夏天，让我们加入不负蜀光支教队，让我们一起发光发热！支教的课程除了高中的九门基础课程之外，还有红十字会特色——急救、防灾、防艾等内容；如果你有其他兴趣特长，也可以开设相关课程，把有趣的知识带给大家。此外，支教还可以计入志愿时长哦！具体信息支教学校：四川省长宁中学，坐落在长宁河畔，省级示范性普通高中，历史悠久，文化深厚，名满蜀南。支教方式：线下支教对象：高一新生课程内容：急救、防灾、防艾内容；基于高中的九门科目及兴趣内容招募人数：15-20人招募要求：全体同学，不限年级专业；能熟练制作PPT；有授课技能；热情、真诚、大方、有耐心。报名方式：加入QQ群884525751，后续通知在群里发布（可以扫描下方二维码加入群聊）旭日初升，其道大光。光影静静划过书页，清风又掀开新的篇章。不负蜀光，不负自己，这个夏天，我们期待您的加入！ 2022微信公众号丨BNU红会 微博丨北京师范大学红十字会 文案丨竹子排版丨洛夜审核丨二狗责编丨加贝,https://mp.weixin.qq.com/s?src=11&timestamp=1751859595&ver=6097&signature=2HWbuXG0T2tWPA3-IX9cdpOXf1e2l2B5nKWj6Bb4rtscHifgCZ-mTKGA7VAmdhR*ixuxLSnJLOGjyz3KJtnHF2BC4REUemjEU4M8iclgfryQn4vm4iKXqoRbSRLpHcD7&new=1,,假期的日子里,88452575;二维码
“园满假期”暨清华、北大、北师大三校联合支教来了,清华赣协,2020-12-23,01活动简介“圆满假期”是由北京圆网慈善基金会——善多多舆中国儿童少年基金会联合50多所高校、江西等十省共青团、中国青年网等机构共同发起，为大学生假期返乡量身订制的大学生公益活动。活动由中国儿童少年基金会、央视网、腾讯承办，在“圆满假期”小程序平台全流程开展、呈现和传播。本次活动由江西省驻京办承办，在清华大学、北京大学、北京师范大学三所大学内招募志愿者返回江西进行支教。02活动基本信息支教时间与支教地：武宁船滩中学：1月24日——1月31日宜春第七中学：1月24日——1月31日修水漫江乡中小学：1月22日——1月28日03报名方式预计招募人数：10人左右。报名方式：扫描下方二维码进行报名。联系人：乐昊联系电话：18811386718微信：LH3329993830截止时间：12月26日22点整注意事项：支教形式可能根据疫情情况动态调整。支教过程中务必做好个人防疫措施。填写问卷后请停留几秒不要直接退出，扫码加入群聊。文案|乐昊排版|乐昊审核|乐昊 陈泊明 欧阳子路,https://mp.weixin.qq.com/s?src=11&timestamp=1751859595&ver=6097&signature=tM4iWIcvCwoDS0p6Dn8EqL4dVdqDgmxCOTvNaO*afevtrXbfODGjhrsqd81YHbgozDgXSwc9*wJuM-Dq2*onOU0ju2FA*yA33RirHqxB1xMdZCgfPt8Yiu9Aj78tEWPV&new=1,,“圆满假期”小程序平台全流程开展,18811386;18811386718;33299938;二维码
北师大毕业生选择去农村支教，是因为…… | 新网师2023年秋季入学申请,新网师,2023-7-16,"寻找尺码相同者 | 新网师2023年秋季招生简章职业生涯史按照要求，这里本身要写职业生涯史，可是作为一名应届毕业生，我的职业生涯为0年，因此对于职业生涯似乎没有什么可说的。然而，作为一名学习了7年教育学专业的学生，我常常沉浸在教育、教师、学习、学生这些话语体系中，相信这为自己未来的职业生涯的选择和发展埋下了种子。直到最后具体地选择做一名教师时，我觉得，职业生涯的开端也就自然成了职业生涯史。我16年-20年本科在郑州大学教育学院读教育学专业，20年-23年硕士在北京师范大学教育技术学院读远程教育（目前已改名为“互联网教育”）专业。记不得当初为什么选择教育学专业了，但我知道这个专业不同于师范类专业，它不是培养老师的，可能也正是因为这一点，我就选择了这个专业。这个意思是说，当高中毕业之际，我对教师这一职业是很抵触的，为什么呢？第一，教师处于一种夹缝关系中。一边执行上级领导并不怎么科学的种种指示，另一边又要压制学生的种种叛逆，尽管有些时候可以进行温和的解释，但对于现状的改变是无能为力的。第二，教师是一个没有社会地位的职业。作为一名教师，常年教些不变的知识、应试的知识，最多在学生眼里发挥点作用,在学校里发挥点作用，视野相当狭窄。出了学校，教师对于社会当中的实际问题，既没有成熟的看法和实际的经历，也几乎没有影响力。总而言之，教师无论在校内还是校外，是一种没有话语权的存在，他们只能在有限的范围内，扮演一个教书匠的角色。上面的这种认识，一直潜藏在心里，一直到研二，接触到魏老师、干老师，又经由他们了解到更多优秀的老师后，我对教师这一角色的认识发生了变化。第一，教师作为人类文明的传承者，最有机会去接近人类的精神财富。在《教师阅读地图》一书中，魏老师把一名教师应掌握的知识分为三类，学科专业知识、专业知识、人类基本知识。所谓人类基本知识，“则是不仅针对教师而言，乃是应该具备的人类基本知识”，它构成了教师教育教学更广阔的背景。与这类知识相关的书籍，可能包括《万历十五年》《<论语>今读》《第五项修炼》等等。同时也是在魏老师的“咖啡馆”里，看到了更多教育之外的书籍被拿来解决教育问题。正是这种对于教师的要求，让我看到了教师成为一种超越教学的完整的人。当教师成为一个完整的人的时候，他的课堂、他对学生的影响才能超越应试，也变得完整。第二，教师是能够发挥社会影响力的。教师有能够发挥社会影响力的能力，本质上来源于他对教育长期的行动与思考，表面上则来源于互联网所赋予他的话语权或职位赋予他的权力。之所以有前者认识，是因为看到像王开东、李镇西等等老师们，常常在网络上发声，对教育、对社会问题针砭时弊；也有很多老师在网络上讲课，影响百万学生，其价值丝毫不输学校里的老师。之所以有后者的认识，则是因为看到一些校长、教育组织的先进办学理念和令人向往的实践，以及一些学者对实践问题的关注。总之，在我的视野扩大了之后，我对教师这一职业有了新的认识。“非道弘人，而人能弘道”，不能因为存在一些不合理的教育现象和不合格的教师，就否定理想教育和优秀教师的存在，从“实然”到“应然”，本身就是实现自我价值要追求的。再来谈一下我具体的职业选择，为什么要去做一名支教老师？我是一个特别注重意义感的人，所谓的意义感，我觉得就是自主决策去做一件事的感觉。在22年的4月，我这样总结我的职业价值观：我在哪里最能带给他人价值，我就要到哪里去。所以当越来越多身边同专业的人把目标瞄向体制内的所谓安稳、大厂的高薪、大城市的繁华的时候，我意识到这些地方是不需要我的。与其锦上添花，不如雪中送炭，只有在最需要我的地方才是我价值发挥最大的地方。我有一种“叛逆”的心理，偏偏不想走被外界认定为理想化的道路。这时，当我环顾整个教育领域的时候，我发现，乡村的教育是最需要我的，并且我也是适合和认同乡村教育的价值的。是的，我发现并选择了乡村教育。首先，从个人经历角度来说，我自己也是从农村走过来的，当我回顾自己受教育生涯的时候，发现好的老师不多，但这意味着一旦碰到好老师，就会产生很大的影响。用钱理群老师的话说，一位好老师会给学生带来“瞬间永恒效应”。我至今仍然记得，小学4-6年级的语文老师引导我要重视阅读课外书，初中数学老师引导我要靠自学成才。此外，我们现在的生活，尤其是网络世界中的生活，越来越呈现出一种城市化的导向，这让我越发怀念起童年时的一些场景：栽一颗桃树苗，并把它培养到开花结果；不用栓绳，和狗子一块在林间地头奔跑；有一个大大的院子，承载一年四季的变化……这样的场景在城市是很难得到的，这样我更想回到乡村，回到一种亲近自然的生活。最近，还连续看到几篇公众号文章，讲农村大学生遗憾和无奈地讨论大学时期家境和眼界如何限制了自己的发展。我在想，大学生活一定程度也是城市导向的，比如在衣食住行方面，比如在一些城市特有的文体活动方面，因此，农村学生在这方面不如城市学生很正常。但评价标准换了呢，农村学生还会不如城市学生吗？比如，下河摸鱼，下田种地等等农林牧渔方面的事务。放下城市导向的眼光，这些事情其实不应该被小看。其次，从专业认识的角度来说，教育信息化一路走来，向农村教育先后输送了硬件设备和丰富的数字化学习资源，还有各种所谓的合作模式，把乡村师生与城市师生建立起了远程联系，仿佛解决城乡教育失衡问题未来可期，但乡村师资建设问题才是重中之重，因为我们无法忽略教育中人与人之间面对面相处的重要性。很欣喜地看到，去年师大120年校庆时，习大大给师大“优师计划”师范生的回信中提到：“毕业后到祖国和人民最需要的地方去”，同样是去年，还看到教育部在《新时代基础教育强师计划》中提到，要培养一批硕士层次的中小学教师，并侧重向农村教育输送。这些事情，让我感受到一种时代的召唤。以上，还只是一些头脑中的想法，而与此同时的一些行动，才是更重要的。记得是在2021年教师节前后，通过B站第一次了解到了美丽中国这个支教组织（西部计划的一个专项），那是第一次了解到两年的长期支教项目，心里想，原来支教也能成为一份全职工作。随后我检索了大量支教老师的故事，对他们既佩服又羡慕，想做些什么，可又觉得，我做不到他们那样。为了弥补我内心的缺憾，我“大手一挥”，在腾讯公益上给美丽中国捐了100块，仿佛自己也参与了进去。随后，我仍关注着项目，包括参与线上线下的宣讲，其中最重要的是22年10-12月，参加了他们组织的与乡村学生线上共读一本书的活动。我和一位四年级的女生H共读了《特别的女生萨哈拉》这本书。H和书中萨哈拉十分相像，她们渴望认同，却不敢迈出步子，内心丰富，却怯于表达。这让我发现，这种情况其实意味着通过矛盾的转化，每个孩子成长的潜力都可能被激发。事实正是如此，在最后一次交流中，我感受到H“掏心窝子”地与我聊她对学习对读书的感受。我觉得可能换一个小朋友，这种热情的聊天会很正常，但是我恰恰不想做这样一个比较。每一个小朋友的性格都是千差万别的，他们对待别人的态度也会千差万别。与我而言，我与H的交流是一段特殊的旅程，换一个我，换一个她，都无法实现这段旅程对彼此的意义。当我正式成为一个老师之后，我仍然将面对的是一个又一个具体的学生。在此之前的暑假，我还有另外一段35天的乡村教育的经历。这35天，我协助一家社会企业，在郑州中牟县下设的一个村里为小学生提供公益托管服务。学生数量有近20个，包含1-6年级，他们性格各异、成绩各异。通过与这家企业的创始人接触，我切身体会到，农村教育在现有教育体系里是处于多么弱势的地位。他们县里，30%学生考不上高中，成为学校和家长眼中的失败者，考上高中的学生又有90%上不了重本甚至一本，四年大学生涯后除了空拿一个毕业证，既没有获得能力提升，也没有获得能为职业发展提供竞争力的学历资本。而到了这种地步，他们不一定会责怪教育，而是会责怪为什么自己在这个体系中没有胜出，于是，他们又会寄希望于自己的孩子将来能通过这套教育体系胜出。此时，一个新的恶性循环又开始了。他们不明白，通过这套教育体系的胜出者数量极少又充满偶然。这时，我开始思考教育的出发点是什么？我们在对教育焦虑什么？教育是在淘汰人还是在培养人？在经历了以上种种的思考与行动后，在今年的7月底，我将开启我至少两年的作为乡村教师的职业生涯了。加入新网师的原因为什么要加入新网师？新网师招生简章的微信推文标题，用到了一个概念——“尺码相同者”。这个概念对我并不陌生，很早就在魏老师南明教育的招聘中看到过，那里解释说，“尺码相同”这个概念，来自于一本儿童文学著作《特别的女生萨哈拉》。它本是说，有些人天生就是不懂诗歌，也不懂热爱诗歌者对诗歌的热爱，因为他们彼此间尺码不同。后来，这个概念成为了南明教育的团队文化，指的是卓越、热爱、合作、担当。在招生简章中看到，新网师的“尺码”是热爱学习、热爱教育、热爱生命。很少看到一个招生简章、一个课程介绍，或者一个什么宣传，把“热爱”作为一个核心词，尽管提到热爱，可能也是顶着热爱的噱头，实际上大家是否热爱，难以看得出来。在“热爱”上，从我简短的职业生涯来看，我自以为和新网师达成了共识。但我知道，我的热爱很可能是一种浅层次的热爱，因此我的职业生涯才刚刚开始，在接下来现实的浑水里，不知道是否还能保持一种纯净，去达成更高层次的热爱。不过现在要做的，至少要把路尽可能走对，选择加入“新网师”，去进行专业的学习、去寻找优质的共同体，驾驶着“阅读、交流、实践、反思”四个轮子缺一不可的“教育之车”，徐徐前行。不经意的相遇，造就了如今非凡的自己如何帮助每位教师找到当下自己成长最需要的？| Q&A新网师秋季课程分级背后的思考我给新网师提建议作者：王小凯 西部计划云南地区支教老师编辑：杨茜审核：王娜 柳静新网师成立于2009年，全称为“新教育网络教师学习中心”（原名“新教育实验网络师范学院”），是新教育实验旗下的教师培训机构，是面向全国所有教育工作者的在线专业学习共同体。“新网师”秉承新教育实验理念，以“过一种幸福完整的教育生活”为愿景，以汇聚“真正热爱教育、真正热爱学习、真正热爱生命”的尺码相同者为感召，遵循教师成长规律，践行教师专业成长理论，通过专业阅读、专业写作、专业交往的“三专”模式，培养高素质、专业化、创新型的教师队伍。",https://mp.weixin.qq.com/s?src=11&timestamp=1751859595&ver=6097&signature=bVORVJKj8a7gasus3PA6pYRUDG1upj0xTizQRHgoWxSzJeEZ0FR10jyr4vDxdHnVVVuxMsXaXToNUYesiWRf2jHKryUUahJJUFFaShgTuTdAY*P73vsA0lWEKWBSzaxQ&new=1,,职业生涯似乎没有什么可说的,
